{"base_campaign":{"path":"/srv/sparkinterval-operator/config/h100-production-template.json","sha256":"0000000000000000000000000000000000000000000000000000000000000000","size_bytes":0},"build":{"boost_include_root":"/srv/sparkinterval-source/boost-1.83.0","host_cxx":{"path":"/usr/bin/g++","sha256":"0000000000000000000000000000000000000000000000000000000000000000","size_bytes":0},"nvcc":{"path":"/usr/local/cuda/bin/nvcc","sha256":"0000000000000000000000000000000000000000000000000000000000000000","size_bytes":0},"python":{"path":"/usr/bin/python3","sha256":"0000000000000000000000000000000000000000000000000000000000000000","size_bytes":0}},"kind":"sparkinterval.azure.h100.r2star-materializer-site.v1","output_root":"/srv/sparkinterval-operator/materialized/ramare-zuniga-lemma-6-2","schema_version":1}
